{
  "schema": "dev.woia.property-acquisition-delta/v1",
  "id": "property-acquisition-real-estate",
  "core": {
    "plugin": "woia-core",
    "repository": "Turpial-AI-Academy/woia-core-agent-plugin",
    "version": "0.5.7",
    "ref": "v0.5.7",
    "commit": "b5506b6f73fc209915d92a7bb679c8d79d12a760",
    "tree": "881bd4bf508c676dfcd3e2cec388a398d9bf03c9"
  },
  "base": {
    "plugin": "woia-supply-acquisition",
    "repository": "Turpial-AI-Academy/woia-supply-acquisition-agent-plugin",
    "version": "0.5.7",
    "ref": "v0.5.7",
    "commit": "c49ef3bfb96880c7af36996e919e09b1e7caeaa0",
    "tree": "71d8376d25590be4e90011b5f1da3d1b66e46886"
  },
  "providers": [
    {
      "plugin": "woia-identity",
      "repository": "Turpial-AI-Academy/woia-identity-agent-plugin",
      "version": "0.5.7",
      "ref": "v0.5.7",
      "commit": "8ad93549ba8236a8c738aef503c4bf290668094c",
      "tree": "31bc3029d98701fd7311b5996a184611f67874e3"
    },
    {
      "plugin": "woia-communications",
      "repository": "Turpial-AI-Academy/woia-communications-agent-plugin",
      "version": "0.5.7",
      "ref": "v0.5.7",
      "commit": "dd50174aa782f6b8235bb1f35f4e1331850f0fae",
      "tree": "2aeef36779e5e27c988ccf820c7a68f94b5c8528"
    },
    {
      "plugin": "woia-documents",
      "repository": "Turpial-AI-Academy/woia-documents-agent-plugin",
      "version": "0.5.7",
      "ref": "v0.5.7",
      "commit": "ca38580868aefc6b720a70613ab53e224833417f",
      "tree": "7c92bc224bec37d800458f3956b2f0c4c22f5244"
    },
    {
      "plugin": "woia-organization-knowledge",
      "repository": "Turpial-AI-Academy/woia-organization-knowledge-agent-plugin",
      "version": "0.5.7",
      "ref": "v0.5.7",
      "commit": "547591284a6d8240926952c541873bea284d84e3",
      "tree": "2e11d20ad2273a9473f3ca5fcda4cdbea2ccfb83"
    },
    {
      "plugin": "woia-sales-lead-qualification",
      "repository": "Turpial-AI-Academy/woia-sales-lead-qualification-agent-plugin",
      "version": "0.5.7",
      "ref": "v0.5.7",
      "commit": "dd2e36cf3f91d587f60480425c232fb7e3c54d8a",
      "tree": "4d429b68833d69d953fe0a97ed92c98b06effc39"
    },
    {
      "plugin": "woia-sales-pipeline",
      "repository": "Turpial-AI-Academy/woia-sales-pipeline-agent-plugin",
      "version": "0.5.7",
      "ref": "v0.5.7",
      "commit": "e938839de2bbb85e1fbc9b55559ae64ddfdece62",
      "tree": "c343b13ed658658f97c0daa4b1750b5de1a8a126"
    },
    {
      "plugin": "woia-re-domain-contracts",
      "repository": "Turpial-AI-Academy/woia-re-domain-contracts-agent-plugin",
      "version": "0.5.7",
      "ref": "v0.5.7",
      "commit": "1b656bcf591e6c8055e9372426ecafca686f7899",
      "tree": "b6734ef9e5e83b5073fb4820a2824a9023eb6581"
    },
    {
      "plugin": "woia-re-property-data",
      "repository": "Turpial-AI-Academy/woia-re-property-data-agent-plugin",
      "version": "0.5.7",
      "ref": "v0.5.7",
      "commit": "632e94a692984177247eb57d02369bd14b7935dc",
      "tree": "a7ec266d3b6603815aede8074617ef392ebbfd29"
    }
  ],
  "base_range": {
    "min_inclusive": "0.5.0",
    "max_exclusive": "0.6.0"
  },
  "exported_slots": [
    "service-intake",
    "representation-authorization",
    "readiness-evaluation",
    "receiver-contribution",
    "outcome-continuity"
  ],
  "operations": [
    {
      "operation": "SPECIALIZE",
      "slot": "service-intake"
    },
    {
      "operation": "NARROW",
      "slot": "representation-authorization"
    },
    {
      "operation": "SPECIALIZE",
      "slot": "readiness-evaluation"
    },
    {
      "operation": "NARROW",
      "slot": "receiver-contribution"
    },
    {
      "operation": "ADD",
      "slot": "outcome-continuity"
    }
  ],
  "inherited_gates": [
    "base-conformance",
    "authority-narrowing",
    "provider-closure",
    "update-recovery"
  ],
  "additional_gates": [
    "delta-semantics"
  ],
  "expected_active_roots": 1,
  "selected_root": "woia-re-property-acquisition",
  "status": "NOT_QUALIFIED",
  "evaluated_pairs": []
}
